หมาขุดหลุมในสวนเพื่อที่จะซ่อนกระดูก,El perro excavó un hoyo en el jardín para esconder un hueso.,
ตัวละครที่โดนดูถูกมากที่สุดในหนังสือนั้นกลับกลายเป็นฮีโร่ของเนื้อเรื่อง,El personaje más menospreciado del libro acabó siendo el héroe de la trama.,
นักการเมืองเลี่ยงคำถามด้วยคำตอบแบบกำกวม,El político eludió la pregunta con una respuesta ambigua.,
นักโทษแขวน(คอ)ตัวเองในห้องขังของเขาด้วยเชือกที่เขาได้ซ่อนไว้,El preso se ahorcó en su celda con una cuerda que había escondido.,- pasado
นายกรัฐมนตรีเปิดเผยแก่สื่อมวลชนว่าเขาตั้งใจจะยุบสภาผู้แทนฯ และจัดการเลือกตั้งทั่วไป,El primer ministro manifestó a la prensa que iba a disolver la Cámara de Representantes y adelantar las elecciones generales.,
ผู้ชมโห่ไปยังนักเตะฟุตบอลเมื่อเขาเตะลูกโทษไม่เข้า,El público abucheó al futbolista cuando falló el penalti.,
ผู้ชมไม่หยุดตะโกน,El público no cesaba de gritar.,- pretérito imperfecto
ผู้คนออกันที่ประตูสเตเดียมเพื่อซื้อตั๋วคอนเสิร์ต,El público se apelotonaba en las puertas del estadio para comprar las entradas del concierto.,pretérido imperfecto
คน(เอก)ที่ยังไม่ได้ทำการบ้านออกไปเล่นไม่ได้,El que no haya acabado de hacer los deberes no puede salir a jugar.,
ผลการเลือกตั้งถูกนับคืนนี้,El resultado de las elecciones se escruta esta noche.,- presente
ผลการเลือกตั้งจะประกาศในกระดานข่าวของบริษัท,El resultado de las elecciones será publicado en el boletín de la empresa.,- ใช้ ser + participio
แม่น้ำไนล์ไหลลงไปในทะเลเมดิเตอร์เรเนียน,El río Nilo desemboca en el Mediterráneo.,
"แม่น้ำ<sub>(สายนี้)</sub>แบ่งเขต<u style="""">ระหว่าง</u>สองหมู่บ้าน",El río marca el confín entre los dos pueblos.,
ทางเดินแยกแตกออกไปใน<u>กลาง</u>ป่า,El sendero se bifurca en el medio del bosque.,
ดวงอาทิตย์ส่องแสงและอากาศร้อนมาก,El sol resplandecía y hacía mucho calor.,- pretérito imperfecto
เสียงรองเท้าส้นสูงของฉันดังสะท้อนในโบสถ์ที่เงียบงัน,El sonido de mis tacones retumba en la iglesia silenciosa.,
อาการเหนื่อยหมดแรงที่คุณรู้สึกเป็นผลข้างเคียง<u>หนึ่ง</u>ของการรักษา,El sopor que sientes es un afecto secundario del medicamento.,presente
แผ่นดินไหวทำให้เกิดเศษหินเศษปูนร่วงหล่นมาจากอาคาร,El terremoto ha provocado la caída de cascotes del edificio.,- perfecto
เวลาผ่านไปเร็ว,El tiempo pasa volando.,
(เพราะการจราจร)เราติดแหง่กในถนน ก็เลยมาถึงบ้านช้ามาก ๆ,El tráfico nos demoró y llegamos tardísimo a casa.,- pretérito indefinido
ลมหนาวทำปากฉันแตก,El viento frío me ha agrietado los labios.,- perfecto
ลมพัดจนเส้นผมของเธอพันกันไปหมด,El viento te enredó el pelo.,
เธอรู้สึกอ่อนแรงมากและเกือบจะเป็นลมในยิมเมื่อเช้านี้,Ella se sintió muy débil y estuvo a punto de desmayarse en el gimnasio esta mañana.,- เธอ - บุรุษที่ 3<br>- pretérito indefinido
เธอ(๓)รู้สึก(!se)เศร้าโศกเสียใจ(d)กับการตายของสามีของเธอ,Ella sentía tal desolación por la muerte de su marido.,- pretérito imperfecto
เธอมีความโดดเด่นเพราะด้วยสติปัญญา ไม่ใช่แค่เพียงเพราะความงามของเธอ,"Ella sobresale por su inteligencia, no solo por su belleza.",
ในกรณีฉุกเฉิน ให้ดึงคันโยกของอุปกรณ์แจ้งเตือนภัย,"En caso de emergencia, tiren de la palanca del aparato de alarma.",ustedes
ในดิสก์นี้คุณสามารถเก็บ(ข้อมูล)ได้ถึงสองเทราไบต์,En este disco puedes almacenar hasta dos terabytes.,
ครอบครัวของฉันพวกเราอายุยืนทุกคน,En mi familia somos todos longevos.,
ในหน้าร้อนต้องตัด<sub>(เกี่ยว)</sub>หญ้าแทบทุกสัปดาห์เลย,En verano hay que segar el césped casi todas las semanas.,
เขาใส่ยาพิษลงไปในชีสหนึ่งก้อนเพื่อที่จะ<u>สามารถ</u>ฆ่าหนู(ญ)ที่อยู่ในบ้านของเขาได้,Envenenó un trozo de queso para poder matar la rata que habitaba en su casa.,
มันน่าท่อแท้ที่ได้รับเกรดต่ำ ๆ หลังจากอ่านหนังสือหนัก,Es descorazonador obtener una nota tan baja después de tanto estudiar.,
จำเป็น(i)ที่ผู้สมัคร(พหู)ต้องพูดได้อย่างน้อยสามภาษา,Es imprescindible que los candidatos hablen al menos tres idiomas.,
เขาเป็นเพื่อนเที่ยวเพื่อนเมาของฉัน,Es mi amigo de juergas y borracheras.,
เขามีชื่อเสียงมาก ใบหน้าของเขา<b><u><i>ได้</i></u></b>ปรากฏอยู่ที่หน้าปกของนิตยสารทุกเล่มเลย,"Es muy famoso, su rostro ha aparecido en las portadas de todas las revistas.",
เขาเป็นคนเข้าสังคมมากจึงรู้จักผู้คนหลากหลาย,"Es muy sociable, por consiguiente conoce a mucha gente.",consiguiente
เขาหัวแข็งมาก เกือบจะเป็นไปไม่ได้เลยที่ทำให้เขาเปลี่ยนความคิดได้,"Es muy tozudo, es casi imposible lograr que cambie de opinión.",
มันเป็นเรื่องย้อนแย้งที่เขาจะเรียนวิทยาศาสตร์ถ้าเขาไม่ชอบคณิตศาสตร์,Es paradójico que estudie ciencias si no le gustan las matemáticas.,
เป็นเรื่องที่น่าเสียดายที่ยังมีผู้คนทรมานจากความหิวอยู่ในโลกนี้,Es una lástima que todavía haya gente que padezca hambre en este mundo.,
ผู้หญิง<u>คนนั้น</u>กวนใจฉัน ก็เลยโทรหาตำรวจ,"Esa mujer me mosqueó, y llamé a la policía.",- pretérito indefinido
ผู้หญิง<u>คนนั้น</u>ขอให้ฉันเอาข้อความนี้มาให้เธอ<u>ทันที</u>,Esa mujer me pidió que te diera este mensaje enseguida.,
รูปวาดผนังถ้ำโบราณ<u>เหล่านั้น</u>ยังอยู่ในสภาพที่สมบูรณ์,Esas milenarias pinturas rupestres están en perfectas condiciones.,
คนไร้บ้านคนนั้นตัวเหม็น และเสื้อผ้าของเขาก็ยิ่งกว่าสกปรก,Ese vagabundo apestaba y sus ropas estaban más que sucias.,- pretérito imperfecto
พวกเกี่ยวกับซื้อผลิตภัณฑ์เพื่อสิ่งแวดล้อมมันก็ดีมากนะ แต่แน่นอนว่ามันแพงกว่าซื้อแบบปกติทั่วไป<b><i><u>มาก</u></i></b>,Eso de comprar productos ecológicos está muy bien; pero claro son mucho más caros que los normales.,
ที่ว่าเขาจะห้ามจอดรถ(a)นั้น ไม่ใช่เรื่องจริง,"Eso de que vayan a prohibir el aparcamiento, no es cierto.",
ฉันหวังว่าแผล(รอยตัด)นี่จะไม่กลายเป็นแผลเป็นนะ,Espero que el corte no me deje una cicatriz.,
เราหวังให้วันงานแต่งงานนั้นแดดออก แต่แทนที่จะเป็นแบบนั้นฝันดันตกลงมาห่าใหญ่,"Esperábamos que el día de la boda fuera soleado, pero en vez de eso nos tocó un chaparrón.",- pretérito<br>- ฝน (ch)
ประโยคนี้ไม่สามารถเข้าใจได้ถ้าแปลตรง ๆ เป็นภาษาสเปน,Esta frase no se entiende si se la traduce literalmente al castellano.,
การ์ดนี้สามารถใช้กับกล้องดิจิตัลรุ่นไหนก็ได้,Esta tarjeta se puede usar con cualquier cámara digital.,
ครั้งนี้เธอทำมันพังหมดเลยนะ บอกแล้วว่าไม่ให้บอกใครใช่ไหม,"Esta vez sí que metiste la pata. Te dije que no se lo contaras a nadie, ¿no?",ใช้สำนวน ~ pata
ฉันแค่ถามคำถามเชิงโวหารไปงั้น เธอไม่ต้องตอบก็ได้,Estaba haciendo una pregunta retórica. No tienes que responder.,
สองชิ้นนี้มันไม่เข้ากัน (เสียบกันไม่ได้),Estas dos piezas no encajan.,
ชิ้นงานศิลปหัตถกรรมเหล่านี้ถูกทำด้วยความพิถีพิถันเป็นอย่างยิ่ง,Estas piezas de artesanía están hechas con mucho esmero.,
โทรศัพท์เครื่องนี้มี<u>หลาย</u>ฟีเจอร์<u>กว่า</u> และเพราะเหตุนี้ราคามันจึงแพงกว่า,Este móvil tiene más prestaciones y por eso su precio es más alto.,
งานนี้น่าเบื่อเพราะมันซ้ำไปซ้ำมา<b><i><u>มาก</u></i></b>,Este trabajo es un coñazo porque es muy repetitivo.,
ดึงผ้าปูเตียงให้ตึง ๆ ไม่ให้มีรอยยับ,Estira la sábana para que no quede ninguna arruga.,
ฉันกำลังคิดว่าจะสมัครงานตำแหน่งไหนก็ได้ตำแหน่งหนึ่งเพื่อที่จะได้มีงานประจำทำสักครั้ง,Estoy pensando en presentarme a una oposición cualquiera para tener de una vez un trabajo fijo.,
ฉันเรียนในสถาบันแห่งหนึ่งที่ไม่เกี่ยวกับศาสนาเพราะพ่อแม่ฉันไม่ใช่คนเคร่งศาสนา,Estudio en un instituto secular porque mis padres no son religiosos.,
อ่านหนังสือสอบทั้งคืนแล้วก็ไปสอบทั้งอย่างนั้นเลย,Estudio toda la noche y voy de empalme al examen.,- presente
เรากำลังกินข้าวกันอย่างเงียบ ๆ แล้ว<b><u>ตอนนั้น</u></b> Marcos ก็เข้ามาตะโกนโหวกเหวกเหมือนคนบ้า,"Estábamos comiendo tan tranquilos y, entonces, entró Marcos dando gritos como un loco.",- pasado
Fernando ยึดมั่น(กับความคิดที่)ว่าจะต้องไปเรียนที่สเปนให้ได้ และเขาก็ทำมันได้สำเร็จ,Fernando se aferró a la idea de estudiar en España y lo logró.,- pretérito indefinido
เราจะยอมเซ็นสัญญาใหม่<u>ก็เมื่อ</u>บริษัทจะยอมพิจารณาเงินเดือนเป็นรายปี,Firmaremos el nuevo convenio siempre que la empresa se comprometa a revisar los salarios anualmente.,"- ใช้ ""siempre que"""
เขา<u>ใช้ฝอยขัดหม้อ</u>ขัดจุดที่เป็นไขมัน(เอก)บนกระทะ,Frotó la mancha de grasa de la sartén con el estropajo.,- pretérito indefinido
Gabriela ซ่อนความเศร้าของเธอไว้ภายใต้รอยยิ้ม,Gabriela disimula su tristeza detrás de una sonrisa.,
เขาตกอยู่ในสภาวะช็อกอย่างรุนแรงเมื่อทราบข่าวการเสียชีวิตของคุณตาของเขา,Ha sufrido una fuerte conmoción al saber de la muerte de su abuelo.,- perfecto
ฟ้าเปิดได้สักพักแล้ว เธอเก็บร่มได้แล้ว,"Hace un rato que escampó, puedes cerrar el paraguas.",
เราจะเข้าเรียนวิชาคอมพิวเตอร์ขั้นสูง<b><i><u>ที่ฝ่ายบริหารเสนอ</u></i></b><u>โดยมีข้อแม้</u>คือคาบเรียนต้องไม่ตรงกับช่วงเสาร์อาทิตย์,Haremos el curso de informática avanzada que propone la dirección a condición de que no se haga durante el fin de semana.,"- ใช้ ""a condición de que"""
เธอได้ผ่านความยากลำบาก(พหู)ที่น้อยคนนัก<u>จะสามารถ</u>เข้าใจ<u>ได้</u>,Has atravesado dificultades que poca gente podrá entender.,
ต้องแหย่ไปที่ไฟนะเพราะว่ามันกำลังจะดับ,Hay que atizar el fuego porque se está apagando.,
จำเป็นที่จะต้องรู้วิธีการจัดการข้อมูลเพื่อดึงประโยชน์ออกมาให้ได้มากที่สุด,Hay que saber cómo manejar los datos para sacarles máximo provecho.,
ทั้งคืนฉันนอนไม่หลับ <u>วันนี้</u>ก็เลยอารมณ์(g)ไม่ดี,He pasado toda la noche desvelado y hoy estoy de mal genio.,- ผ่านทั้งคืน<br>- อารมณ์ไม่ดี (g)<br>- perfecto y presente
ฉันโสดมาตลอดชีวิต ฉันไม่รู้เลยว่าฉันเตรียมพร้อมสำหรับชีวิตหลังแต่งงานแล้วหรือยัง,He sido soltero toda mi vida. No sé si estoy preparado para la vida conyugal.,
เราได้เปลี่ยนพื้นห้องครัวใหม่เพราะว่ากระเบื้องมันเก่ามาก,Hemos cambiado el suelo de la cocina porque las baldosas estaban muy viejas.,
หลายชั่วโมงหลังจากแผ่นดินไหว ทีมกู้ภัยหลายทีมก็ได้นำเสบียงอาหารเข้าไปยังพื้นที่ประสบภัย,"Horas después del terremoto, varios equipos de salvamento llevaron víveres a la zona afectada.",
มีพายุแล้วไฟก็ดับ ฉันจึงไม่สามารถทำงานได้,"Hubo una tormenta y se fue la luz, por eso no podía trabajar.",อดีต
การ<b><u>พยายาม</u></b>ปีนเขาโดยไม่เอาเสื้อผ้ากันหนาวไปด้วยเป็นการตัดสินใจที่ประมาทมาก ๆ,Intentar subir la montaña sin ropa de abrigo fue muy una decisión imprudente.,- pretérito indefinido
ใส่เหรียญหนึ่งเหรียญลงไปในช่องเพื่อเริ่มเล่น,Introduce una moneda por la ranura para comenzar a jugar.,
เขารู้สึกว่า Felipe น่าจะโทรมาเย็นนี้ แล้วมันก็เกิดขึ้นจริง ๆ,Intuyó que Felipe llamaría esta tarde y así sucedió.,- pasado
Juan เป็นคนขี้เซามาก และตื่นนอนตอนเช้าไม่ได้ง่าย ๆ เลย,Juan es muy dormilón y le cuesta mucho levantarse por las mañanas.,
Juan ได้ใช้จอบขุดหลุมเพื่อปลูกต้นไม้,Juan ha cavado un hoyo con la pala para plantar un árbol.,- perfecto
"จังหวะตอนที่ฉัน<u style="""">เกือบ</u>จะเหยาะพริกไทยไปในซุปก็นึกขึ้นได้ว่า Rosa แพ้(อาหาร)","Justo cuando estaba a punto de poner pimienta en la sopa, me di cuenta de que a Rosa le da alergia.",- pasado
เคียฟเป็นเมืองที่ผู้อพยพหลายคนจากเขต(พหู)ที่ได้รับผลกระทบจากการปนเปื้อนกัมมันตรังสีอาศัยอยู่,Kief es una ciudad donde viven muchos refugiados procedentes de las zonas afectadas por la contaminación radiactiva.,
การชันสูตรศพเปิดเผยว่าผู้ชาย(คนนี้)เสียชีวิตด้วยโรคหัวใจกำเริบ,La autopsia desveló que el hombre había muerto de un ataque al corazón.,- pasado
เด็กผู้หญิง(c)ร้องไห้สะอึกสะอื้นอยู่ใต้โต๊ะ,La chica sollozaba bajo la mesa.,- pretérito imperfecto
กุญแจความสำเร็จของเผ่าพันธุ์มนุษย์คือความสามารถ(ของเขา)(เพื่อ)ในการปรับตัวเข้ากับสภาพแวดล้อม,La clave del éxito de la especie humana ha sido su capacidad para adaptarse al entorno.,- perfecto
ประกาศรับสมัคร(นี้)มีเพื่อคนทำงานคนไหนก็ได้ที่มีอายุ<b><u><i>มากกว่า</i></u></b> 25 ปี,La convocatoria va dirigida a cualquier trabajador mayor de veinticinco años.,
มงกุฎทองคำของพระราชาเป็นประกายระยิบระยับใต้แสงดวงอาทิตย์,La corona de oro del rey resplandecía bajo la luz del sol.,- pretérito imperfecto
การตัดสินใจเกือบเป็นเอกฉันท์ มีเพียงหนึ่งเสียงที่งดออกเสียง,La decisión fue tomada casi por unanimidad con una abstención.,
การพูดคุย(ปรึกษา)กับภรรยาของเขาทำให้เกิดความไม่สบายใจติดค้างอยู่ที่เขายังไม่สามารถสะบัดมันให้หลุดไปได้จนเดินทางไปถึงปารีส,La discusión con su mujer le provocó un desasosiego del que todavía no había podido liberarse cuando llegó a París.,- pasado
การเรียงตัวของทวีปนั้นได้รับผลมาจากการเคลื่อนตัวของแผ่นทวีป,La disposición de los continentes es afectada por la deriva continental.,
รูปปั้นทำมาจากแผ่นเหล็ก,La escultura está hecha de chapa de hierro.,- รูปปั้น ไม่ใช่ อนุเสาวรีย์
การไม่ได้ยินข่าวคราวของลูกชายของเธอทำให้แม่เกิดอาการวิตกกังวล,La falta de noticias de su hijo le producía angustia a la madre.,- pretérito imperfecto
คนจากหมู่บ้านได้เข้ามาร่วมกับพวกเรา โดยเขาทำหน้าที่จัดเตรียมอาหารสำหรับเหล่าอาสาสมัคร,La gente del pueblo ha volcado con nosotros y se encarga de preparar la comida para los voluntarios.,"- perfecto, presente"
มนุษยชาติจำเป็นที่จะต้องแก้ไขปัญหาสิ่งแวดล้อมอย่างเร่งด่วน,La humanidad tiene que resolver urgentemente el problema del medio ambiente.,
ความชื้น<u>ช่วยทำให้เกิด</u>การเจริญเติบโตของแบคทีเรีย,La humedad propicia el crecimiento de bacterias.,
เหยือกมีรอยบิ่น เพราะงี้มันก็เลยถูกขนาดนี้,"La jarra está desportillada, y por eso es tan barata.",
ฝนปรอย ๆ ไม่สามารถหยุดยั้งการจัดคอนเสิร์ตได้,La llovizna no impidió que se celebrara el concierto.,- หยุดยั้ง (im~)
ฝนหยุดตกและความหนาวก็เริ่มรุนแรงขึ้น,La lluvia cesó y arrenció el frío.,- pretérito indefinido
แม่ใช้พัดไล่(e)แมลงวัน,La madre espantó las moscas con un abanico.,pretérito indefinido
อาจารย์(mญ)สะกดคำ(พหู)เพื่อให้เด็ก ๆ (n) สามารถเขียนได้อย่างไม่ผิดหลัก,La maestra deletreó las palabras para que los niños las escribieran sin faltas de ortografía.,- pretérito indefinido
โต๊ะไม่สมดุลจากขาสามข้างที่ยังเหลืออยู่,La mesa se mantiene en vilo sobre las tres patas que le quedan.,
หิมะบนหลังคารถนั้นทับถมกันเป็นก้อน<b><u><i>แล้ว</i></u></b>,La nieve encima del coche ya ha cuajado.,- perfecto
สำนักงานกลางจะทำการมอบหมายข้าราชการคนหนึ่งในการสอบสวนกรณีนี้,La oficina central va a adscribir un funcionario para investigar el caso.,
องค์กรได้ระงับการจัดกิจกรรมอันเนื่องมากจากสาเหตุไม่พึงประสงค์,La organización ha suspendido el evento por causas ajenas a su voluntad.,
ลูกบอลกระเด้ง และไปหยุดอยู่กลางถนน,La pelota rebotó y fue a parar en medio de la carretera.,- pretérito indefinido
ประตูส่งเสียงเอี๊ยดเมื่อถูกลมพัดจนเปิดออกอย่างช้า ๆ,La puerta rechinó cuando el viento la abrió lentamente.,
ราชินีปลดอัศวิน<b><i><u>ออกจากตำแหน่ง</u></i></b>หลังจากรู้เรื่องอื้อฉาว,La reina despojó al caballero de su título después de que se enterara del escándalo.,- pasado<br>- รู้: enterarse
สัปดาห์ที่จะถึงนี้พวกเราหยุดพักร้อนและไม่ไปสอนในชั้นเรียน,La semana que viene tenemos vacaciones y no damos clase.,
อุณหภูมิแตะ 42 องศาในช่วงสุดสัปดาห์,La temperatura alcanzó los cuarenta y dos grados el fin de semana.,pasado
