เพราะได้ละเลยจุดบกพร่องที่ได้มีการบ่งชี้ไว้แล้ว นี่จึงเป็นอุบัติเหตุที่ไม่แปลกใจเลยที่มันเกิดขึ้น,指摘された欠陥を放置していたのだから、これは起こるべくして起こった事故だ。,・『べくして』を使う
เรื่องการทำความสะอาดไม่ต้องพูดถึง แค่ฟูกนอนยังไม่เคยยกขึ้นมา,掃除は疎か、布団を上げたこともない。,
นักเรียนเล่นโทรศัพท์มือถือแม้ในชั่วโมงเรียน โดยไม่สนใจคำเตือนครั้งแล้วครั้งเล่าของคุณครู,教師の再三の注意をよそに、学生は授業中も携帯電話をいじっている。,・『をよそに』を使って
ไปเดินเล่นก็เลยรวดซื้อนมมาจากร้านสะดวกซื้อน่ะ,散歩がてら、コンビニで牛乳を買ってきたよ。,
ปัญหาระหว่างการท่องเที่ยวนั่น ไม่มีเลยเป็นการดีที่สุด แต่บางครั้งเรื่องไม่คาดฝันก็กลายเป็นความทรงจำดี ๆ ได้เช่นกัน,旅行中のトラブルは、ないに越したことはないが、案外それがいい思い出になることもある。,・『越す』を使って
ถึงจะเป็นฤดูใบไม้<b><i><u>ผลิ</u></i></b>ก็เถอะ วันนี้ยังหนาวอยู่เลย,春とはいえ、今日はまだ寒い。,・「とはいえ」を使って。
(คำขึ้นต้นจดหมาย) เนื่องด้วยสถานการณ์ปัจจุบัน กรุณารักษาสุขภาพด้วย,時節柄、ご自愛ください。,
ถึงค่าจ้างจะขึ้นแต่อย่าคาดหวังไว้ดีกว่า อย่างมากก็คงประมาณ 50 เยนแหละ,時給が上がるといっても期待しない方がいいよ。せいぜい50円といったところだよ。,・「といったところ」を使って。
บริษัทที่ยอดขายเติบโตอย่างราบรื่นโดยไม่ได้รับผลกระทบจากภาวะเศรษฐกิจที่ซบเซาก็มี,景気の低迷をよそに、順調に売り上げを伸ばしている会社もある。,・『をよそに』を使って
พร้อมด้วยเศรษฐกิจที่ย่ำแย่ลงเรื่อย ๆ โรงงานจำเป็นต้องปิดตัวลง,景気悪化に伴い、工場は閉鎖を余儀なくされた。,・『余儀』を使って
พนักงานในห้างสรรพสินค้าที่มีชื่อเสียง แม้กระทั่งคำพูดคำจายังสุภาพอ่อนน้อม,有名デパートの店員は、言葉遣いからして丁寧だ。,・『からして』を使って
นักกีฬาที่คาดหวังไว้ดันบาดเจ็บจนลงสนามไม่ได้นี่มันน่าเสียดายที่สุดเลยเนอะ,期待していた選手が怪我で出場できないのは残念極まるね。,
ที่สามารถเข้าสู่รอบชิงชนะเลิศได้นั้น เป็นเพราะความร่วมมือกันของทีม,決勝に進出できたのはチームの団結あってのことだ。,・『あっての』を使って
ไม่ว่าจะเป็นน้ำพุร้อน หรือจะเป็นลานสกี ฮอกไกโดในฤดูหนาวนั้นเต็มเปี่ยมไปด้วยมนต์เสน่ห์สำหรับนักท่องเที่ยว,温泉といい、スキー場といい、冬の北海道は観光客にとって魅力いっぱいです。,・『～といい』と使って<br>・丁寧語
ช่วงที่เกิดภัยพิบัติ องค์กรภาคเอกชนรับมือได้อย่างฉับไว ผิดกับภาครัฐที่เห็นได้ชัดว่ารับมือได้อย่างล่าช้า,災害時、迅速に対応した民間団体にひきかえ、政府は対応の遅れが目立った。,・『ひきかえ』を使って<br>・ผิดกับภาครัฐที่ความล่าช้าของการรับมือนั้นเห็นได้ชัด
ไฟหน้าก็ไม่เปิด แถมยังเล่นโทรศัพท์(เมล)ขณะขี่จักรยาน ช่างไม่มีสามัญสำนึกเสียเลย,無灯火の上にメールしながら自転車に乗るなんて、非常識にもほどがある。,
ไม่ว่าจะเป็นสุนัขหรือแมว แมนชันที่นี่ห้ามเลี้ยงสัตว์,犬であれ猫であれ、このマンションでペットを飼うことは禁止されています。,・『であれ』を使って<br>・丁寧語
เรื่องความจำเป็นในการรักษาสิ่งแวดล้อมนั้น ไม่จำเป็นที่จะต้องไปทำประชาพิจารณ์อีกครั้ง,環境保護の必要性は、改めて世論に問うまでもないことだ。,『までもない』を使って
เขาไม่มาโดยอ้างว่าป่วย,病気を口実にして彼は来なかった。,
ไม่ใช่แค่กับมะเร็งอย่างเดียว แต่การตรวจเจอโรคตั้งแต่เนิ่น ๆ นั้นดีที่สุด,癌に限らず、病気の発見は早いに越したことはない。,・「越す」を使って
ถ้าสายตาไม่ดี ใส่แว่นตาหรือไม่ก็คอนแทคเลนส์ก็ได้นี่,目が悪いなら、眼鏡なりコンタクトなりすればいいのに。,・『～なり～なり』を使って
เพราะคู่แข่งแบบนี้ จึงน่าจะเป็นการแข่งขันที่ตึงเครียดน่าดู,相手が相手だけに、緊迫した試合になるだろう。,・『〜だけに』を使って
หวังว่าปัญหาเรื่องการสืบทอดมรดกจะแก้ไขได้ด้วยการประชุมหารือระหว่างผู้ที่เกี่ยวข้อง,相続問題は当事者の協議をもって解決することが望ましい。,・『をもって』を使って
เพราะ(ความเหมาะสม)ชุดที่ใส่มา ก็เลยทำให้ทำใจเข้าร้านอาหารหรู ๆ แบบนี้ลำบาก,着ている服が服なだけに、こんな高級レストランに入りづらい。,・『〜なだけに』を使って
ไม่อยากให้ใช้ภาษีของพวกเราไปอย่างสูญเปล่าแม้แต่เยนเดียว,私たちの税金は1円たりとも無駄に使って欲しくない。,・『たりとも』を使って
พวกเราชอบที่จะตัดสินนิสัยของคนคนนั้นจากสัญชาติเท่านั้น,私たちは国籍だけでその人の性格を判断してしまうきらいがある。,・『きらいがある』を使って
โรงเรียนฉันมีกฎระเบียบเยอะแยะเต็มไปหมดจนเหมือนจะหายใจไม่ออก,私の学校は規則ずくめで、息つまりそうだ。,・『ずくめ』を使って
ฉันสำลักควัน,私は煙でむせた。,
ฉันผูกปมได้<u>ไม่ค่อย</u>เก่ง,私は結び目をあまり上手にはつくれない。,
คิดว่าเพราะด้วยแนวคิดการบริหารธุรกิจที่ไม่ตรงกัน ก็เลยไม่แปลกใจที่สองคนนั้นจะแยกทางกัน,経営に対する考え方が違っていたから、あの二人は別れるべくして別れただと思う。,・『べくして』を使う
งานแต่งงานเนี่ย คนที่ว่าถึงไม่จัดก็ไม่เป็นไรหรอกมันก็มี,結婚式なんて、しなければしないで別に構わないという人もいる。,・「〜ば〜で」使って
ถ้าเป็นนายกรัฐมนตรีแล้วละก็ คำพูดและการกระทำแต่ละอย่างล้วนส่งผลกระทบอันใหญ่หลวง,総理大臣ともなると、その言動の一つ一つが大きな影響を与える。,『ともなると』を使って
ตรวจปมเชือกที่หลวมทุกจุดให้ดี แล้วผูกให้แน่นซะ,緩い結び目を全て点検してしっかりしめなさい。,
จ่ายเองยังพอว่านะ แต่นี่จะให้ผมจ่ายให้ทั้งหมดแล้วยังจะกินต่ออีกหรอ,自分で払うならまだしも、全部僕に払わせるのにまだ食べるつもり？,
ไม่สามารถฝืนกฎธรรมชาติได้,自然の法則には逆らえない。,
ถ้าไม่มีวัตถุดิบที่ดีก็ไม่มีอาหารที่อร่อย,良い材料あっての美味しい料理。,・『あっての』を使って
ฤดูโรคแพ้เกสรดอกไม้มาถึงแล้ว ทั้งอาการคันตาและน้ำมูกที่ไหลไม่หยุดนี่ทำอะไรไม่ได้เลยหรอ,花粉症の季節がやってきた。この目のかゆみと止まらない鼻水を何とかできないものか。,・「ものか」を使って
แม้จะเป็นผู้พิพากษาก็<u>ต้อง</u>มีบ้างที่ไม่สามารถควบคุมอารมณ์ได้,裁判官といえども感情を抑えきれないころもあるはずだ。,・『といえども』を使って
พอเห็นพ่อแม่ไม่ดุ ลูกเลยได้ใจถือโอกาสวิ่งแจ้นไปทั่วขบวนรถไฟ,親が叱らないのをいいことに、子どもは電車の中を走り回っている。,
สมาคมท่องเที่ยวมีแผนที่จะทำแคมเปญเพื่อผลักดันการท่องเที่ยวในฤดูหนาวของพื้นที่นั้น,観光協会はその地域の冬の観光を促進するためにキャンペーンを施行する予定である。,
ทนฟังคำพูดของนักการเมืองที่เอาแต่พูดข้ออ้างไม่ได้,言い訳ばかりしている政治家の話は聞くにたえない。,
เราจะติดต่อกับผู้ที่ตรงกับเกณฑ์ผ่านทางอีเมล,該当者にはメールで連絡します。,
ยานพาหนะที่ตรงกับเกณฑ์กรุณาเคลื่อนไปยังลานจอดรถ,該当車両は駐車場に移動してください。,
หลังจากบทความทางวิชาการได้รับการยอมรับจากนานาชาติ เขาก็ทุ่มเทให้กับงานวิจัยมากยิ่งขึ้นกว่าเมื่อก่อน,論文が国際的に評価されてから、彼は以前にもまして研究に打ち込んでいる。,・『にもまして』を使って
ทนดูผู้คนยากจนกำลังทรมานอย่างเงียบ ๆ ไม่ได้,貧困に苦しむ人々を黙って見てはいられなかったのです。,・過去形<br>・丁寧語
ไม่มีรถมันก็ไม่สะดวกนะ แต่ถึงจะมีก็ต้องจ่ายค่าบำรุงรักษาอีก เป็นเรื่องที่น่าลำบาก,車はないと不便だが、あったらあったで維持費がかかるから困ったものだ。,・「〜たで」を使って
อยากจะลาออกแต่ก็ลาไม่ได้,辞めるに辞められない。,
ติดเล่นเกินไปทำให้ไม่สนใจการเรียน,遊びに夢中で勉強が疎かになる。,
กำลังจะมีการเลือกตั้งในอีก 1 สัปดาห์หลังจากนี้ บรรดาผู้สื่อขาวจึงยุ่งกว่าปกติ,選挙を1週間後に控え、記者たちは普段にもまして忙しい。,・『にもまして』を使って
ต้องติดต่อหัวหน้าแผนก แต่ว่าเวลาขนาดนี้แล้วโทรไปก็คงไม่เหมาะสินะ,部長に連絡しなきゃいけないんだけど、時間が時間なだけに電話はまずいよね。,・『〜なだけに』を使って
เดินมานานจนเหนื่อยมาก,長く歩いたので疲れ果てた。,・『果て』を使って
เสียงรบกวนจากข้างห้อง ถ้านาน ๆ ทีก็ไม่เท่าไหร่ แต่ติดต่อแบบนี้นี่ยอมเขาเลย,隣の部屋の騒音、たまにならまだしも、こう続くとまいっちゃうよ。,
ถึงจะเป็นวัชพืช แต่ว่าแต่ละชนิดก็มีชื่อเฉพาะของมันเอง,雑草といえども、それぞれに名前がある。,・『といえども』を使って
ไหนจะเปียกฝน ไหนจะถูกเจ้านายดุ เป็นวันที่โชคร้ายจริง ๆ,雨にふられるわ、上司に叱られるわ、ついていない1日だった。,・『～わ～わ』を使って
ถูกล้วงกระเป๋าบนรถไฟ แต่จะว่าโชคดีก็ไม่ใช่ โชคร้ายก็ไม่เชิง เพราะข้างในมีเงินแค่ 100 เยนเอง,電車で財布を盗まれたんですが、運がよかったといおうか、悪かったといおうか、中に100円しか入っていなかったんです。,・「いおうか」を使って<br>・丁寧語
หากสูญเสียความไว้วางใจจากลูกค้าเพียงครั้งเดียวแล้ว คงจะเรียกคืนกลับมาได้ยาก,顧客からの信頼は一度失ったが最後、取り戻すことは難しいだろう。,・ลูกค้า - 顧客<br>・『が最後』を使って
