タイ語,日本語,หมายเหตุ
ห้องของเขานั้น ไม่ว่าจะพื้นหรือ<b><u><i>บน</i></u></b>เตียงก็มีของกระจัดกระจาย(二文字)เต็มไปหมด,彼の部屋は、床といわずベッドの上といわず、いろいろなものが散乱しています。,・「〜いわず」を使って<br>・丁寧語
ไม่มีเหตุผลที่เธอจะ<u>รู้สึก</u>มีปมด้อยกับใคร,あなたは誰にも劣等感を感じる理由はない。,
คนนั้น เดี๋ยวหัวเราะเดี๋ยวก็โกรธ หลายหลายอารมณ์จังเลยนะ,あの人、笑ったり怒ったりして、喜怒哀楽が激しいんだね。,・四字熟語を使って
ถ้าพิจารณาถึงสภาพการณ์การบริหารงานอย่างชุ่ยของบริษัทนั้นแล้ว ไม่พูดไม่ได้เลยว่าไม่แปลกใจที่มีปัญหาในครั้งนี้ออกมา,あの会社の杜撰な経営体質を考えると、今回の問題は出るべくして出たと言わざるを得ないだろう。,・『べくして』を使って
ไม่น่าเชื่อเลยว่าคนแก่ที่ดูใจดีคนนั้นจะเป็นผู้ร้ายในคดีชิงทรัพย์,あの優しそうな老人が強盗事件の犯人だったとは…,・『とは』を使って
ผู้หญิงคนนั้นเอาแต่โกหกมาตั้งแต่เป็นเด็ก <u>สุดท้าย</u>ก็เลยถูกจับกุมเพราะต้มตุ๋น,あの女は子供のころから嘘ばかりついていて、最後には詐欺で捕まるしまつだ。,・『しまつ』を使って
เด็กคนนั้นพยายามช่วยเหลือ(助)พ่อแม่ตามประสาเด็ก,あの子は幼いなりに親を助けようとしている。,・『なりに』を使って
ภาพยนตร์เรื่องนั้นภาคก่อนมีคนดูเกิน 2.5 ล้านคนแท้ ๆ แต่ได้ยินมาว่าภาคต่อมีคนดูไม่ถึงล้านคนเลย,あの映画は前作の観客が250万人を超えたのにひきかえ、続編は100万人も届かなかったそうだ。,『ひきかえ』を使って
หนังเรื่องนั้น<b><u>เนื้อหา</u></b>ซับซ้อนที่สุด จึงไม่เป็นที่นิยมในหมู่เด็ก ๆ,あの映画は複雑極まる内容で、子どもには人気がない。,
ประธานนักเรียนคนนั้นเป็นคนโปร่งใสตรงไปตรงมา ก็เลยไว้ใจได้,あの生徒会長は公明正大だから信頼できる。,・四字熟語を使って
ถ้าจำนวนผู้โดยสารลดลงอย่างนี้ต่อไป คงจำเป็นจะต้องยกเลิกเส้นทางรถไฟเส้นนี้,このまま利用者が減れば、この鉄道は廃線を余儀なくされるだろう。,・『余儀』を使って
คอมพิวเตอร์เครื่องนี้เก่าเกินไปแล้ว แม้แต่เวลาที่ใช้เปิดเครื่องก็ยังมากกว่า 3 เท่าของเครื่องรุ่นใหม่ ๆ,このパソコンは古すぎる。起動にかかる時間からして最新種類の３倍以上だ。,・『からして』を使って
ได้ยินมาว่าถ้าสูบบุหรี่บนท้องถนนในเขตนี้จะถูกปรับไม่เกินหนึ่งหมื่นเยนตามกฎข้อบังคับ,この地区で路上喫煙すると、条例に則して1万円以下の罰金が科せられるそうだ。,『そくし』を使って
สิ่งที่อาศัยอยู่ในจักรวาลไม่มีที่สิ้นสุดนี้มีแต่มนุษยชาติเราหรือ,この果てしない宇宙にいるのは、私たち人類だけですか。,・丁寧語
เนื่องจากห้องพักที่นี่ทั้งเงียบสงบและการเข้าถึงจราจรก็สะดวก ผู้สนใจเข้ามาอยู่จึงแห่มากัน(สอบถาม)มากมาย,この物件は、静かで交通も便利とあって、入居希望者が殺到している。,・『とあって』を使って
เมืองนี้ถ้าขืนไปผิดถนนแค่เส้นเดียว จะไปโผล่ที่ไหนก็ไม่รู้เลย,この町は道を一本間違えようものなら、全然知らない場所に出てしまう。,・「ものなら」を使って
หวังเป็นอย่างยิ่งว่างานวิจัยนี้จะเป็นหนทางหนึ่งในการรักษาโรคที่รักษาได้ยาก,この研究が難病治療の一助となることを期待してやまない。,・『やまない』を使って
ถ้าเป็นเรื่องระดับนี้ คงไม่จำเป็นต้องขอคำแนะนำจากประธานบริษัท,この程度のことなら、社長の指示を仰ぐまでもないだろう。,『までもない』を使って
รถยนต์คันนี้ไม่เพียงแต่รูปลักษณ์(การออกแบบ)เท่านั้น สมรรถนะยังดีด้วย,この車はデザインもさることながら、性能もいい。,『もさることながら』を使って
รถยนต์คันนี้กินน้ำมันก็น้อย และด้วยดีไซน์ที่มีระดับ พูดได้ว่าไม่แปลกใจเลยที่ขายดี,この車は燃費も良く、洗練されたデザインで、売れるべくして売れたと言える。,・『べくして』を使って
นี่คือพระพุทธรูปที่เป็นระดับสมบัติของชาติ　เพราะเป็นสิ่งของระดับนี้ จึงไม่สามารถขนส่งไปโดยใช้บริษัทขนส่งธรรมดา ๆ ได้,これは国宝級の仏像なのです。物が物なだけに、普通の運送業者には頼めません。,・『〜なだけに』を使って<br>・丁寧語
บริษัทแบบนี้เดี๋ยวจะลาออกให้ดู,こんな会社辞めてやる。,・『やる』を使って
ไม่ว่าจะด้วยเหตุผลใดก็ตาม การใช้กำลังก็ให้อภัยไม่ได้,たとえどんな理由であれ、暴力は許されない。,『であれ』を使って
คว้านแกนแอปเปิล,りんごの芯を抉る。,
กลุ่มผู้ประท้วงเมื่อวานนี้นั้น ได้ปิดถนนหลายเส้นบริเวณใจกลางเมือง,デモ隊が昨日、町の中心部のいくつかの道路を閉鎖した。,
ผู้ว่าการ<u>รัฐ</u>นิวยอร์กได้ประกาศสถานการณ์ฉุกเฉิน,ニューヨーク州知事は非常事態宣言を発令した。,
ถ้าตั้งใจจะเป็นนักเปียโน การเริ่มต้นไวนั้นดีที่สุดแล้ว แต่คนที่เพิ่งมาเริ่มหัดตอนมัธยมปลายแล้วมาเชี่ยวชาญในภายหลังมันก็มีเหมือนกันนะ,ピアニストを目指すなら、早く始めるに越したことはないでしょうが、高校生から始めてプロになった人もいますよ。,・「越す」を使って<br>・丁寧語
ถึงจะเป็นแมนชันที่ให้เลี้ยงสัตว์ได้ก็เถอะ ไม่ได้แปลว่าจะเลี้ยงสัตว์ชนิดไหนก็ได้,ペット可のマンションとはいえ、どんな動物でも飼えるわけではない。,・「とはいえ」を使って。
กำลังอ่านหนังสือเรียนอย่างใจจดใจจ่อ,一心不乱に勉強している。,・四字熟語を使って
ขอเวลาอีกสามวัน,三日間ご猶予を願います。,・丁寧語
เจ้านายเข้าโรงพยาบาล จึงไปปรึกษาเกี่ยวกับการดำเนินงาน และถือโอกาสไปเยี่ยมด้วย,上司が入院したので、お見舞いかたがた仕事の進め方について相談に行った。,・『かたがた』を使って
จำเป็นที่จะต้องเชื่อฟังคำสั่งของหัวหน้า,上司の指示を仰ぐことが必要です。,丁寧語
เอาเงินที่พ่อแม่ส่งมาจากการหามาด้วยความยากลำบากไปเที่ยวเล่นนี่ ช่างอกตัญญูเสียเหลือเกิน,両親が苦労して送ってくれたお金を遊びに使うなんて、親不孝にもほどがある。,
เพราะ(ความหรูหราของ)รถที่นั่งมา น่าจะโดนเข้าใจผิดว่าเป็นคนรวยแหละ,乗っている車が車なだけに、金持ちだと誤解されるかもしれないよ。,・『なだけに』を使って
สถานการณ์<sub>(สภาพการณ์)</sub>แบบนี้รอช้าไม่ได้แล้ว,事態は一刻の猶予も許されない。,
ในการป้องกันไม่ให้เกิดอุบัติเหตุบนท้องถนน ทั้งคนเดินถนนและคนขับรถต้องเคารพสัญญาณจราจร,交通事故を防止するには、歩行者も運転手も信号を守らなければなりません。,・丁寧語
นิสัยของคนเรามีทั้งด้านดีและด้านไม่ดีเนอะ,人の性格は一長一短だね。,・四字熟語を使って
<u>ขอ</u>ให้ตลอดทั้งปีนี้เป็นปีแห่งสันติภาพ,今年1年が平和な年になることを願ってやみません。,・丁寧語<br>・『やまない』を使って
งานวันนี้จะเสร็จกี่โมงก็ยังไม่รู้ แต่ถึงจะขึ้นรถไฟเที่ยวสุดท้ายไม่ทันก็เถอะ ยังไงก็พักบ้านเพื่อนอยู่แล้ว ไม่เป็นไรหรอก,今日の仕事は何時に終わるかわからないんだけど、終電に乗れなかったら乗れなかったで、友達のうちに泊まるから大丈夫だよ。,・「〜たで」を使って
เนื่องจากวันนี้เป็นวันอาทิตย์แรกของวันหยุดฤดูร้อน สถานที่เล่นน้ำชายทะเล<u>ทั่วประเทศ</u>จึงคับคั่งไปด้วยผู้คนจำนวนมาก,今日は夏休み最初の日曜とあって、全国の海水浴場は多くの人で賑わった。,・『とあって』をつかって
งานยุ่งมาก แม้แต่พักเที่ยงก็ยังพักได้ไม่เต็มที่,仕事が忙しすぎて、昼休みすら満足に取れない。,・『すら』を使って
ฉันเข้าใจว่าบริษัทต้องการการทำงานที่ทำได้อย่างไม่มีตำหนิ,仕事を卒なくこなす事を会社は求めている事はわかります。,・丁寧語
เงินที่ยืมไปก็ยังไม่คืน แถมมาขอยืมอีก ช่างหน้าด้านเสียเหลือเกิน,借りた金を返さずに、また借りに来るとは、図々しいにもほどがある。,
เพื่อจะได้หลุดพ้นจากชีวิตที่มีหนี้สินท่วมตัว จึงตัดสินใจไปปรึกษาทนายความ,借金まみれの生活から脱出するために、弁護士に相談しに行くことにした。,・『まみれ』を使って
ฉันเสียดายที่มองข้ามเรื่องสุขภาพ,健康を疎かにしたことを悔やんでいる。,
ไม่รู้จักแยกชีวิตส่วนตัวและการงาน,公私の別を弁えない。,
การเล่นสเกตบนทะเลสาบที่จับตัวเป็นน้ำแข็งนั้น เป็นการละเล่นอันสนุกสนานที่มีเฉพาะในประเทศทางตอนเหนือเท่านั้น,凍った湖の上でのスケートは、北国ならではの楽しい遊びだ。,・『ならでは』を使って
เนื่องจากเวลาทับซ้อนกับการไปทำงานนอกสถานที่ จึงขอยกเลิกการประชุม,出張と重なってしまったために、会議を中止させていただいた次第です。,・丁寧語<br>・『次第』を使って
นอนเต็นท์เป็นครั้งแรก แม้จะไม่ถึงกับพูดได้ว่าอยู่สบาย แต่ก็ไม่เลวร้ายเท่าที่คิด,初めてテントに寝たが、快適とは言えないまでも、思ったほど悪くはなかった。,『ないまでも』を使って
การที่คนฉลองวันปีใหม่ในศาลเจ้า จัดงานแต่งงานในโบสถ์ และจัดงานศพที่วัดแล้วไม่ใช่เรื่องน่าแปลกนั้น คิดว่าเป็นลักษณะเฉพาะของประเทศญี่ปุ่นที่ไม่เคร่งครัดเรื่องศาสนามากนัก,初詣は神社、結婚式は教会、葬式は寺でする人が珍しくないのは、宗教に寛容な日本ならではだと思う。,・『ならでは』を使って
ถ้าเก่งภาษาอังกฤษแบบคุณ 加藤 ก็ว่าไปอย่างนะ แต่จะให้ผมเป็นล่ามการประชุมงี้ไม่ไหวนะครับ,加藤さんのように英語が上手ならいざしらず、僕に会議の通訳なんて無理ですよ。,・丁寧語
แม้จะจากประเทศมา 10 ปี แต่ก็ไม่มีมีแต่วันเดียวที่จะลืมบ้านเกิดตัวเอง,国を離れて10年経つが、一日たりとも故郷を忘れたことはない。,・『たりとも』を使って
การทำงาน<sub>(ตอบสนองต่อสถานการณ์)</sub>ของประชาคมนานาชาตินั้น ไม่มีคำว่ารอได้แม้แต่วินาทีเดียว,国際社会の対応には一刻の猶予もありません。,・丁寧語
ผู้ที่จะปกป้องระบบนิเวศของโลกและรักษาสิ่งแวดล้อมได้มีเพียงมนุษยชาติเท่านั้น,地球の生態系を保全し、環境を守ることができるのは、人類をおいて他にない。,『をおいて』を使って
ถึงจะผิดพลาดแต่ทำใหม่อีกทีก็ได้นี่,失敗したら失敗したでまたやればいい。,・「〜たで」を使って
ถ้าอยู่บ้านยังพอทน แต่ไม่อยากให้ใส่ชุดนอนออกไปข้างนอกเลย,家でならまだしも、パジャマで外へ出るのはやめてほしい。,
ถ้าจะซื้อบ้าน ควรขอให้ผู้เชี่ยวชาญช่วยตรวจสอบ<b><u>อย่างละเอียด</u></b>ตั้งแต่ใต้พื้นบ้านจนกระทั่งหลังคาดีกว่านะ,家を買うなら、床下から屋根に至るまで専門家に細かくチェックしてもらった方が良いですよ。,・丁寧語<br>・『に至るまで』を使って
ไม่สนใจงานบ้าน ห้องก็เลยรกรุงรัง,家事が疎かになって、部屋がぐちゃぐちゃだ。,
ค่าเช่าบ้านแพงก็ลำบากอยู่นะ แต่ถ้าถูกก็น่าจะมีปัญหาจนรู้สึกไม่สบายใจอีกแหละ,家賃が高いのも困るけど、安かったら安かったで何か問題がありそうで不安だよね。,・「〜たで」を使って
เอกสารในการสมัครงานจำพวกประวัติส่วนตัวนั้น จะไม่มีการส่งคืนไม่ว่าผลการสมัครจะเป็นอย่างไรก็ตาม,履歴書などの応募書類は、結果のいかんによらず、ご返却いたしません。,・敬語<br>・『いかん～ず』を使って
แม่น้ำขุ่นไปด้วยโคลน,川は泥で濁っていた。,・過去
ที่โรงงานเมื่อผลิตสินค้าใหม่จนเสร็จสมบูรณ์แล้ว ก็จะบรรจุใส่กล่องแล้วส่งออกไปขายทันที,工場では新しい製品が完成するそばから箱詰めされて出荷されていく。,・『そばから』を使って
ทันทีที่พนักงานร้านเปิดประตู ลูกค้าที่เฝ้ารออยู่ก็กรูกันเข้ามา,店員がドアを開けるが早いか、待っていた客がなだれ込んできた。,・『早いか』を使って
บริษัทของเรานั้น ด้วยการบริหารงานตามยุคสมัย ทำให้เป็นผู้นำในวงการธุรกิจ<b><u><i>มาตลอด</i></u></b>,弊社は、時代に即した経営によって、常に業界をリードしてまいりました。,・『そくし』を使って<br>・丁寧語
ไม่ใช่ว่าจะไม่มีหลักฐานที่บอกว่าเขาเป็นผู้ร้าย เพียงแค่<u>ยัง</u>ตัดสินลงไปไม่ได้,彼が犯人だという証拠はないでもないが、まだ断定はできない。,
ความไม่รู้เรื่องของเขาขัดขวางการทำงาน<sub>(การก้าวหน้า)</sub>ของเรา,彼の無知が我々の進歩を妨げた。,
ถ้าเป็นความผิดพลาดของเขา ทางบริษัท<u>คงจะ</u>ต้องเรียกร้องค่าเสียหาย,彼の過失となれば、会社は損害賠償を請求せずにはおかないだろう。,・『おかない』を使って
เริ่มจากนิยายเรื่องนี้กลายเป็นหนังสือขายดี หลังจากนั้นเขาก็เขียนนิยายชุดที่ได้รับความนิยมออกมาเรื่อย ๆ,彼は、この小説がベストセラーになったのを皮切りとして、次々と人気シリーズを生み出していた。,・『皮切り』を使って
เขาน่ะ ท่าทางว่าจะใช้เรื่องการออกทำงานต่างจังหวัดเป็นข้ออ้าง ที่ไหนได้ไปหาแฟนนี่เอง,彼は、地方出張にかこつけて、どうやら彼女に会いに行っているらしい。,
เขาสร้างข้ออ้างขึ้นมา,彼は口実をでっち上げた。,・ข้ออ้าง ≠ 言い訳
เขาเป็นทั้งอาจารย์มหาวิทยาลัยและนักเขียนที่มีชื่อเสียง,彼は大学の教授にして、有名な作家でもある。,・『にして』を使って
เขาถือโอกาสตอนที่พนักงานไม่ได้มองกินช็อกโกแลตฟรีที่แจกให้ชิมไปถึง 3 ชิ้น,彼は店員が見ていないのをいいことに、試食のチョコレートを3つも食べた。,
เขาตาพร่ามัวจากแสงอันเจิดจ้า,彼は強い光りに目が眩んだ。,
เขาถูกแฟนหลอกจนซื้อแหวนราคาแพง,彼は彼女の口車に乗って、高価な指輪を買ってしまった。,
เขาเกิดมาเต็มไปด้วยพรสวรรค์หลากหลายอย่าง ทำอะไรก็ไม่มีจุดตำหนิ,彼は様々な才能に恵まれて、なんでも卒なくこなせる。,
แม้ว่าจะเป็นช่วงฤดูร้อนจัด อย่าว่าแต่แอร์เลย แม้แต่พัดลมเขาก็ไม่ใช้,彼は真夏でも、エアコンはおろか、扇風機さえ使わないそうだ。,・『はおろか』を使って
เขามีเทสดีในด้านศิลปะ,彼は芸術に関しては目が肥えている。,
เป็นพระเอกแต่ดูธรรมดาสามัญแบบเขานั้น(เป็นเรื่องที่)แปลก,彼ほど平々凡々たる主人公は珍しい。,
เธอให้ความทุ่มเททั้งหมดไปกับงานนั้น,彼女はその仕事に全精力をつぎ込んだ。,・เธอ - บุรุษที่ 3
เธอเอาแต่คร่ำครวญเศร้าโศกไปกับการตายของสามีเธอ,彼女は夫の死を嘆き悲しむばかりであった。,・เธอ - บุรุษที่ 3
เธอมีอคติอย่างรุนแรงกับภาพแนวแอบสแตรก,彼女は抽象画に対して強い偏見を持っている。,・เธอ - บุรุษที่ 3
ทันทีที่เธอยืนขึ้น ก็สาดน้ำในแก้วน้ำใส่หน้าเขา,彼女は立ち上がるなり、コップの水を彼の顔にかけた。,・『なり』を使って
คนไข้ที่เข้ารับการผ่าตัดหัวใจนั้นพ้นเขตอันตรายแล้ว,心臓移植手術を受けた患者は危険な状態を脱した。,
จะหลีกเลี่ยงสงครามได้หรือไม่นั้น ขึ้นอยู่กับผลของการประชุม(kd)ในครั้งนี้,戦争を回避できるかどうかは、今回の会談の結果いかんにかかっている。,『いかん』を使って
