日本語,日本語の読み方,タイ語,Add Reverse
我田引水,がでんいんすい,（四字熟語） เอาแต่ประโยชน์ของตัวเองเป็นหลัก,y
戒める,いましめる,ห้ามปราม ตักเตือน ตำหนิ ว่ากล่าวสั่งสอน,
戒名,かいみょう,ชื่อในงานศพ,y
戦略,せんりゃく,กลยุทธ์ ยุทธศาสตร์,y
戯れる,たわむれる,หยอกเย้า แหย่ จีบ,y
所得税,しょとくぜい,ภาษีเงินได้,y
所詮,しょせん,ผลสุดท้าย ในที่สุด ท้ายที่สุด,y
所轄,しょかつ,ขอบเขตของอำนาจ ขอบเขตของการปกครองดูแล,y
扁桃腺,へんとうせん,ต่อมทอนซิล,y
手の甲,てのこう,หลังมือ,y
手取り,てどり,เงินได้สุทธิ,y
手品,てじな,มายากล การเล่นกล,y
手品師,てじなし,นักมายากล (คำญี่ปุ่น),y
手当て,てあて,เบี้ยเลี้ยง เงินช่วยเหลือ,
手探り,てさぐり,การคลำหา การใช้มือควานหา,y
手枷足枷,てかせあしかせ,การพันธนาการ การจำกัดอิสรภาพ,y
手榴弾,しゅりゅうだん,ระเบิดน้อยหน่า,y
手段,しゅだん,วิธี หนทาง,y
手織り,ており,ผ้าทอมือ การทอผ้าด้วยมือ,y
手裏剣,しゅりけん,ดาวกระจาย,y
手錠,てじょう,กุญแจมือ,y
手頃,てごろ,กำลังดี พอเหมาะ สมน้ำสมเนื้อ,y
抉る,えぐる,คว้าน เจาะ เผชิญหน้า,y
把握,はあく,การจับจนแน่น การเข้าใจเป็นอย่างดี,
抑制,よくせい,การควบคุมให้อยู่ในขอบเขต,y
投資家,とうしか,นักลงทุน,y
抗う,あらがう,ต่อต้าน แข็งขืน,
折り返す,おりかえす,วกกลับ โทรกลับ ติดต่อกลับ,y
披露宴,ひろうえん,งานเลี้ยงงานแต่งงาน งานเฉลิมฉลอง,y
抱擁,ほうよう,การกอด,y
抱負,ほうふ,ความตั้งใจที่จะทำ ความคาดหวัง เป้าหมาย (เช่น ปีใหม่),y
抵抗器,ていこうき,ตัวต้านทาน,y
抽象,ちゅうしょう,นามธรรม,y
担う,になう,แบก ขน รับภาระ,
担保,たんぽ,การจำนอง การค้ำประกันในการชำระหนี้,y
担架,たんか,เปลสนาม,y
拉致,らち,การลักพาตัว,y
拒む,こばむ,ปฏิเสธ (!断),y
拗ねる,すねる,งอน,y
拙い,つたない,แย่ เลวร้าย,
拙者,せっしゃ,ฉัน,
拙著,せっちょ,หนังสือของฉัน ผลงานของฉัน,y
拝む,おがむ,ไหว้ รับชม (รูปถ่อมตัวของ 見る),y
拡張子,かくちょうし,นามสกุลไฟล์,y
括約筋,かつやくきん,หูรูด,y
拳,こぶし,กำปั้น,y
拾得,しゅうとく,การเก็บของได้ การหาเจอของที่คนทำหาย,y
持久力,じきゅうりょく,อึด ทรหด สมาธิ,
挑発,ちょうはつ,ยั่วยุ ยั่วยวน (漢字),y
挫ける,くじける,ยอมแพ้ ตัดใจ อ่อนกำลังลง อ่อนแรง (!お),y
振る舞う,ふるまう,กระทำ ประพฤติ เลี้ยงต้อนรับ,
振幅,しんぷく,แอมพลิจูดคลื่น,y
捏ねる,こねる,นวด (แป้ง),y
捏造,ねつぞう,การกุเรื่องขึ้น การปั้นน้ำให้เป็นตัว,y
捕捉,ほそく,การจับ(ศัตรู) การจับ(ความหมาย),y
捕虜,ほりょ,เชลย,y
捻挫,ねんざ,ข้อพลิก / แพลง,y
掃く,はく,กวาด,y
授与,じゅよ,มอบให้,
掌,てのひら,ฝ่ามือ อุ้งมือ,y
排他的論理和,はいたてきろんりわ,XOR,y
排泄,はいせつ,การขับถ่าย การกำจัดของเสียออกจากร่างกาย,y
掟,おきて,กฎชุมชน,y
採決,さいけつ,การลงคะแนนตัดสิน,y
採算,さいさん,ผลกำไร ผลประโยชน์ (!r),y
控訴,こうそ,การยื่นอุธรณ์,y
控除,こうじょ,การลดหย่อนภาษี การหักออก,y
推奨,すいしょう,การแนะนำ การสนับสนุน การเชิดชู,
推移,すいい,การเปลี่ยนผัน การเปลี่ยนแปลงตามเวลา,y
推薦,すいせん,การเสนอชื่อให้ดำรงตำแหน่ง,y
推進,すいしん,การขับเคลื่อน การสนับสนุน การส่งเสริม,y
措置,そち,การจัดการ,
掲載,けいさい,ตีพิมพ์,y
揉み消す,もみけす,ปิดข่าว,y
提示,ていじ,การนำออกมาแสดง การยื่นเอกสาร,
揶揄,やゆ,การหยอกล้อ เย้าแหย่,
揺り籠,ゆりかご,เปล,y
損なう,そこなう,ทำเสียหาย,y
携える,たずさえる,ถือ พาไปด้วย,
搾取,さくしゅ,การรีดไถ การเอาเปรียบ,y
摂取,せっしゅ,การรับเข้า,
摂氏,せっし,องศาเซลเซียส,y
摘発,てきはつ,การเปิดโปง การตีแผ่ การกวาดล้าง การบุกทะลาย,y
撥音,はつおん,เสียง ん,y
操る,あやつる,ควบคุม เชิด บังคับ,y
擦り付ける,なすりつける,โทษ โยนความผิด ป้ายความผิด,y
擦れる,すれる,กระทบ เสียดสี ถลอก สึก,y
支配下,しはいか,อยู่ภายใต้อาณานิคม,
改革,かいかく,ปฏิรูป,y
攻勢,こうせい,การโจมตี การรุกราน,
放射能汚染,ほうしゃのうおせん,การปนเปื้อนสารกัมมันตรังสี,y
政府官邸,せいふかんてい,ทำเนียบรัฐบาล,y
故人,こじん,ผู้วายชนม์,y
救世主,きゅうせいしゅ,ผู้กอบกู้โลก พระผู้ช่วย,y
救済,きゅうさい,การปลดเปลื้อง(หนี้) การบรรเทาทุกข์,y
救護班,きゅうごはん,หน่วยพยาบาล กู้ชีพ,y
教師あり学習,きょうしありがくしゅう,(en: supervised learning),y
教師なし学習,きょうしなしがくしゅう,(en: unsupervised learning),y
教徒,きょうと,ศาสนิกชน,y
敬う,うやまう,เคารพนับถือ (!と),
数学的帰納法,すうがくてききのうほう,การอุปนัยทางคณิตศาสตร์ (en: mathematical induction),y
数珠,じゅず,ลูกประคำ,y
整える,ととのえる,จัดเตรียม จัดแจงให้เรียบร้อย,
整数,せいすう,จำนวนเต็ม,y
敷く,しく,ปู (ที่นอน),y
文字列,もじれつ,สตริง (คอมพิวเตอร์),y
文献,ぶんけん,เอกสาร หนังสือ,
文脈,ぶんみゃく,บริบท,y
料亭,りょうてい,ร้านอาหารญี่ปุ่น,
斬首,ざんしゅ,การตัดหัว การตัดคอ,y
断崖絶壁,だんがいぜっぺき,หน้าผาสูงชัน,y
新疆,しんきょう,ซินเจียง,y
方位磁針,ほういじしん,เข็มทิศ,y
方眼紙,ほうがんし,กระดาษตาราง กระดาษกราฟ,y
方針,ほうしん,นโยบาย เป้าหมาย,
旋毛,つむじ,ลายก้นหอย ขวัญบนหัว,y
日付,ひづけ,วันที่,y
旺盛,おうせい,เต็มเปี่ยม ท่วมท้น,
昇華,しょうか,การระเหิด,y
昇順,しょうじゅん,เรียงจากน้อยไปมาก,y
明朗快活,めいろうかいかつ,（四字熟語） ร่าเริงแจ่มใส,y
星雲,せいうん,เนบิวลา,y
時々刻々,じじこっこく,（四字熟語）ทุกเวลา ทุกขณะ,y
時効,じこう,อายุความ,y
時報,じほう,การเทียบเวลา,y
時節柄,じせつがら,(คำทักทายในจดหมาย) ในช่วงเวลานี้ ในช่วงฤดูกาลนี้,y
晒す,さらす,แฉ,y
晩婚,ばんこん,การแต่งงานช้า,y
晩年,ばんねん,บั้นปลายชีวิต ช่วงหลัง,y
晩節,ばんせつ,ช่วงหลัง ช่วงบั้นปลาย,
晩酌,ばんしゃく,การดื่มเหล้าช่วงอาหารเย็นหรือก่อนนอน,y
普及,ふきゅう,การเผยแพร่ การแพร่หลาย,
景気,けいき,สภาพเศรษฐกิจ,y
晴耕雨読,せいこううどく,（四字熟語）ทำงานในไร่วันแดดออก อ่านหนังสืออยู่บ้านวันฝนตก,y
暁,あかつき,ยามเช้า,
暖炉,だんろ,เตาผิง,y
暗号化,あんごうか,การเข้ารหัส,y
暗唱,あんしょう,ท่องจากความจำ,y
暗算,あんざん,การคิดคำนวณในใจ,
暗黙,あんもく,โดยปริยาย,y
暴く,あばく,ขุดคุ้ย แฉ เปิดโปง (和語),y
暴露,ばくろ,แฉ เปิดโปง (漢字),y
更迭,こうてつ,การย้ายตำแหน่งไปช่วยราชการ,y
書留,かきとめ,จดหมายแบบลงทะเบียน,y
最高裁判所,さいこうさいばんしょ,ศาลฎีกา,y
有益,ゆうえき,เป็นประโยชน์,
服役,ふくえき,การรับโทษ,y
朗読,ろうどく,การอ่านออกเสียง,y
朝三暮四,ちょうさんぼし,（四字熟語） ฟังดูเหมือนจะต่างกันแต่จริง ๆ แล้วเหมือนกัน,y
朝令暮改,ちょうれいぼかい,（四字熟語） เช้าอย่างเย็นอย่าง กลับคำอยู่บ่อย ๆ,y
朝飯前,あさめしまえ,เรื่องเล็กน้อย เรื่องง่าย ๆ กล้วย ๆ,y
木綿,もめん,ฝ้าย นุ่น,y
未熟,みじゅく,ยังไม่ชำนาญ ประสบการณ์น้อย ดิบ,y
本家本元,ほんけほんもと,（四字熟語） ต้นตำรับแรกสุด,y
本能,ほんのう,สัญชาตญาณ,y
朱に交われば赤くなる,しゅにまじわればあかくなる,คบคนพาล พาลพาไปหาผิด คบบัณฑิต บัณฑิตพาไปหาผล,y
朱雀,すざく,หงส์แดง,y
朽ちる,くちる,เน่า ผุพัง เสื่อมสลาย,y
朽ち葉,くちば,ใบไม้แห้ง,y
村八分,むらはちぶ,เนรเทศ ขับไล่,y
杖,つえ,ไม้เท้า,y
杜撰,ずさん,ชุ่ย มักง่าย,y
束縛,そくばく,การจำกัดการกระทำ การควบคุมการกระทำ,
杭,くい,เสาเข็ม,y
松竹梅,しょうちくばい,ต้นสนไผ่บ๊วย สินค้าเกรดสูงกลางต่ำ,y
果敢,かかん,กล้าหาญ,
果樹園,かじゅえん,สวนผลไม้,y
枠,わく,กรอบ รั้ว ขอบเขต โครง,
枠組み,わくぐみ,กรอบ ขอบข่ายงาน,y
枢密,すうみつ,องคมนตรี,y
枷,かせ,ตรวน เครื่องพันธนาการ,y
柔術,じゅうじゅつ,ศิลปะการป้องกันตัว,Y
柵,さく,รั้วไม้ รั้วล้อม,y
栄転,えいてん,เลื่อนขั้นไปหน่วยอื่น,y
栞,しおり,ที่คั่นหนังสือ กำหนดการเดินทาง,y
核心,かくしん,แก่น ใจกลาง เมล็ด,y
根底,こんてい,รากเหง้า รากฐาน ต้นกำเนิด,y
根拠,こんきょ,มูลความจริง,y
格納,かくのう,การเก็บไว้ในโรงเก็บ การเก็บไว้ในหน่วยความจำของคอมพิวเตอร์,y
栽培,さいばい,การเพาะปลูกพืช,y
案山子,かかし,หุ่นไล่กา,y
桑,くわ,หม่อน,y
梱包,こんぽう,การห่อ (พัสดุ),y
棄権,きけん,สละสิทธิ์,y
植木鉢,うえきばち,กระถางต้นไม้,y
植樹,しょくじゅ,การปลูกต้นไม้,y
検察官,けんさつかん,อัยการ,y
検死,けんし,ชันสูตร (ตรวจหาสาเหตุการตาย อาจจะไม่ผ่า),y
検疫,けんえき,การกักกันเพื่อป้องกันโรคติดต่อ,y
検討,けんとう,การพิจารณา,y
楔形文字,くさびがたもじ,อักษรลิ่ม,y
楕円,だえん,วงรี,y
業績,ぎょうせき,ผลประกอบการ,y
極まる,きわまる,มาก ๆ ถึงที่สุด สิ้นสุด ถึงทางตัน,y
極楽浄土,ごくらくじょうど,แดนสุขาวดี,y
楽隊,がくたい,วงดุริยางค์,y
概念,がいねん,แนวความคิด,y
槍（やり）,,หอก,y
標本,ひょうほん,กลุ่มตัวอย่าง (สถิติ),y
標識,ひょうしき,เครื่องหมาย ป้าย สัญญาณ,y
模倣,もほう,การลอกเลียนแบบ,y
模写,もしゃ,คัดลอก ลอกแบบ,y
模型,もけい,โมเดลจำลอง,
横向きに寝る,よこむきにねる,นอนตะแคง,y
横隔膜,おうかくまく,กะบังลม,y
樹木,じゅもく,ต้นไม้（漢字）,y
橇,そり,เกวียนลาก,y
欠陥,けっかん,ข้อบกพร่อง ตำหนิ จุดด่างพร้อย,y
欧州連合,おうしゅうれんごう,สหภาพยุโรป,y
欲張り,よくばり,ความโลภ,y
欺く,あざむく,หลอกลวง (訓読み),y
正当防衛,せいとうぼうえい,การป้องกันตัวสมควรแก่เหตุ,y
正規品,せいきひん,สินค้าของแท้ ถูกลิขสิทธิ์,y
正視,せいし,การมองตรง การเผชิญหน้า,
武将,ぶしょう,นายพล ผู้บัญชาการทหาร,y
歯に衣着せぬ,はにきぬきせぬ,พูดจาขวานผ่าซาก (歯),y
歯石,しせき,หินปูน,y
歯茎,はぐき,เหงือก,y
段取り,だんどり,แผนการดำเนินงาน ขั้นตอน,
母集団,ぼしゅうだん,ประชากร (สถิติ),y
比例,ひれい,แปรผันตรง,y
気晴らし,きばらし,การทำจิตใจให้สดชื่น การหาความบันเทิง,y
気絶する,きぜつする,เป็นลม สลบ,
水平,すいへい,เส้นแนวนอน,y
水準,すいじゅん,ระดับน้ำ ระดับมาตรฐาน,
水瓶座,みずがめざ,ราศีกุมภ์,y
水素,すいそ,ไฮโดรเจน,y
氷柱,つらら,แท่งน้ำแข็ง,y
氷点下,ひょうてんか,อุณหภูมิติดลบ,y
汎用,はんよう,การใช้ได้หลากหลาย เอนกประสงค์,y
汗ばむ,あせばむ,เหงื่อไหล,y
汽笛,きてき,หวูดไอน้ำ,y
沈殿,ちんでん,การตกตะกอน,y
沈黙,ちんもく,การนิ่งเงียบ,y
河口,かこう,ปากแม่น้ำ,y
治外法権,ちがいほうけん,สิทธิสภาพนอกอนาเขต,y
沿う,そう,แล่น เลียบไปตาม ทำตาม,y
沿道,えんどう,ข้างทาง สองฟากทาง,y
法廷,ほうてい,ห้องพิจารณาคดี,y
波括弧,なみかっこ,วงเล็บปีกกา,y
泣き寝入り,なきねいり,นอนร้องไห้,y
泥酔,でいすい,เมาหัวราน้ำ,y
注釈,ちゅうしゃく,การอธิบายประกอบ คำอธิบายเพิ่มเติม เชิงอรรถ,y
洋裁,ようさい,การตัดเย็บเสื้อผ้าแบบตะวันตก,y
洗練する,せんれんする,ขัดเกลา,y
活かす,いかす,ปล่อยให้มีอยู่ ใช้ให้เป็นประโยชน์,y
派遣,はけん,การส่งไปประจำ,y
派閥,はばつ,กลุ่มพวกพ้อง,y
流産,りゅうざん,การแท้ง,y
浪費,ろうひ,ใช้อย่างสิ้นเปลือง,y
浮動小数点数,ふどうしょうすうてんすう,ระบบทศนิยมในคอมพิวเตอร์ (floating point),y
浮腫む,むくむ,บวม เป่ง,y
海王星,かいおうせい,ดาวเนปจูน,y
浸水,しんすい,น้ำท่วมขัง (!か行),y
浸透,しんとう,ซึมซาบ,
消極的,しょうきょくてき,ไม่คล่องแคล่ว ไม่กระตือรือร้น ไม่เป็นฝ่ายรุกหรือเข้าหา,y
消耗,しょうもう,การเผาผลาญ การใช้งาน การใช้พลังงาน,y
淹れる,いれる,ชงเครื่องดื่ม ทำเครื่องดื่ม,y
渇望,かつぼう,ความปรารถนาอย่างยิ่ง การอยากได้มาก,y
減衰,げんすい,การลดทอน การหน่วง การอ่อนกำลัง,
渦中,かちゅう,ในวังวน การเข้าไปพัวพันกับปัญหาหรือความยุ่งยาก,y
温厚,おんこう,สุภาพอ่อนโยน,y
温情,おんじょう,ความมีน้ำใจ,
渾身,こんしん,ทั่วทั้งร่าง,
湿布,しっぷ,แผ่นประคบ กอเอี๊ยะ,y
溶接,ようせつ,การเชื่อมโลหะ,y
滅ぶ,ほろぶ,ล่มสลาย พินาศ (訓読み),y
滑稽,こっけい,ตลก,
滞る,とどこおる,ชะงัก,y
漁る,あさる,หาปลา งมน้ำ งมหา,y
漂う,ただよう,ล่องลอย ท่องไปอย่างไร้จุดหมาย,y
漏洩,ろうえい,การรั่วไหล,y
演算子,えんざんし,ตัวดำเนินการทางคณิตศาสตร์,y
潔い,いさぎよい／いさぎいい,กล้าที่จะตัดใจ,y
潔白,けっぱく,ไม่มีความผิด บริสุทธิ์ ไม่มีพิษภัย (!z),y
潜む,ひそむ,ซุ่มซ่อน หลบ,
潜在,せんざい,การหลบอยู่ภายใน ด้านใต้ อยู่ในจิตใต้สำนึก,
潮汐,ちょうせき,น้ำขึ้นน้ำลง,y
澱む,よどむ,(น้ำ)ขัง,y
激励,げきれい,การให้กำลังใจ,y
濁る,にごる,ขุ่น เสียงขุ่น (กริยา),y
瀕死状態,ひんしじょうたい,สภาวะใกล้ตาย,y
瀬戸際,せとぎわ,ภาวะวิกฤต ตัวชี้ชะตา หัวเลี้ยวหัวต่อ,y
火種,ひだね,ต้นเพลิง สาเหตุที่ทำให้เกิดเรื่องวุ่นวาย,y
火薬,かやく,ดินปืน,y
灯台,とうだい,ประภาคาร,y
灯油,とうゆ,น้ำมันก๊าด,y
炎天下,えんてんか,กลางแจ้งในวันที่แดดจัด,y
炭水化物,たんすいかぶつ,คาร์โบไฮเดรต,y
点呼,てんこ,การขานชื่อทีละคน,y
点検,てんけん,ตรวจตราทีละจุด ตรวจอย่างละเอียด<br>,y
為政者,いせいしゃ,ผู้ปกครองบ้านเมือง,
焙煎する,ばいせんする,คั่ว,y
無我夢中,むがむちゅう,（四字熟語）ทำอย่างไม่คิดชีวิต หมกมุ่นในสิ่งหนึ่งโดยไม่รู้ตัว,y
無洗米,むせんまい,ข้างที่หุงได้เลยแบบไม่ต้องล้าง,y
無神経,むしんけい,ไม่นึกถึงใจเขาใจเรา ไม่รู้สึกรู้สา,y
無線呼び出し,むせんよびだし,เพจเจอร์ (和語),y
無謀,むぼう,สะเพร่า ไม่รู้จักคิด ไม่รู้จักไตร่ตรองให้รอบคอบ (漢字),y
焦らす,じらす,แหย่ ทำให้ฉุนเฉียว,y
照合,しょうごう,การเปรียบเทียบ การตรวจเทียบ,
煩わしい,わずらわしい,ยุ่งยาก น่ารำคาญ,
熟練,じゅくれん,ได้รับการฝึกทักษะ (en: skilled),y
熱心,ねっしん,ความกระตือรือร้น,
熱意,ねつい,ความปรารถนา ความกระตือรือร้น,
熱燗,あつかん,สาเกอุ่น,y
熾烈,しれつ,รุนแรง ดุเดือด,
燦然,さんぜん,สุกใส เป็นประกาย รุ่งโรจน์,
爬虫類,はちゅうるい,สัตว์เลื้อยคลาน,y
片栗粉,かたくりこ,แป้งมัน,y
版画,はんが,ภาพพิมพ์,y
牡牛座,おうしざ,ราศีพฤษภ,y
牡羊座,おひつじざ,ราศีเมษ,y
牢屋,ろうや,คุก,
物乞い,ものごい,ขอทาน (๓),y
物差し,ものさし,ไม้บรรทัด,y
物色,ぶっしょく,เลือก คัดสรร เฟ้นหา รูปร่างสีสัน,
物質,ぶっしつ,สาร วัสดุ (ฟิสิกส์),y
牽制,けんせい,การสกัดกั้น,y
狂牛病,きょうぎゅうびょう,โรควัวบ้า,y
狛犬,こまいぬ,รูปปั้นสุนัขเฝ้าประตู,y
狩猟,しゅりょう,การล่าสัตว์,y
独り占め,ひとりじめ,เอกสิทธิ์ ผูกขาด,y
独断専行,どくだんせんこう,（四字熟語） ทำตามที่ใจคิด ลุยเดี่ยว,y
独楽,こま,ลูกข่าง,y
独立自尊,どくりつじそん,（四字熟語） พึ่งพาตนเอง ก้าวหน้าด้วยตนเองและชื่นชมตนเอง,y
狸寝入りする,たぬきねいりする,แกล้งหลับ,y
猟奇,りょうき,ที่แปลกประหลาด ที่ลึกลับ,
猫糞,ねこばば,การเอาของคนอื่นมาเป็นของตัวเอง,y
猫背,ねこぜ,หลังค่อม,y
献血,けんけつ,การบริจาคเลือด,y
猶予,ゆうよ,ลังเล เลื่อน ผัดผ่อน,y
獅子座,ししざ,ราศีสิงห์,y
玄武,げんぶ,เต่าดำ,y
率いる,ひきいる,นำ เป็นหัวหน้า,y
率先,そっせん,การทำให้ดูเป็นเยี่ยงอย่าง,
珪藻土,けいそうど,ดินเบา,y
琥珀,こはく,สีเหลืองอำพัน,y
